measure,english,draft_esla,revised_esla,esla_for_backtrans,backtranslated_esla,reconciled_esla,final_esla
PINTS,Persistent and Intrusive Negative Thoughts Scale,Escala de Pensamientos Negativos Persistentes e Intrusivos,N/A,Escala de Pensamientos Negativos Persistentes e Intrusivos,Persistent and Intrusive Negative Thoughts Scale,NA,Escala de Pensamientos Negativos Persistentes e Intrusivos
PINTS, Please rate the frequency with which each of these things happen to you when you experience a problem:,Por favor califique la frecuencia con la que cada una de estas cosas le sucede cuando tiene un problema:,N/A,Por favor califique la frecuencia con la que cada una de estas cosas le sucede cuando tiene un problema:,Please rate the frequency in which each of these things happen to you when you have a problem:,NA,Por favor califique la frecuencia con la que cada una de estas cosas le sucede cuando tiene un problema:
PINTS,"1, never | 2,  | 3,  | 4,  | 5, almost always","1, nunca | 2, | 3, | 4, | 5, casi siempre",N/A,"1, nunca | 2, | 3, | 4, | 5, casi siempre","1, never | 2, | 3, | 4, | 5, almost always",NA,"1, nunca | 2, | 3, | 4, | 5, casi siempre"
PINTS,I lay awake at night thinking about things,Me quedo despierto en la cama durante la noche pensando en cosas,N/A,Me quedo despierto en la cama durante la noche pensando en cosas,I lie awake in bed at night thinking about things,"--in bed -- ""lay awake"" implies to be laying down (on the bed). In Spanish, there is no way to convey this without making it more specific",Me quedo despierto en la cama durante la noche pensando en cosas
PINTS,"When I have a problem, I can't get it out of my head","Cuando tengo un problema, no lo puedo sacar de mi cabeza",N/A,"Cuando tengo un problema, no lo puedo sacar de mi cabeza","When I have a problem, I can't get it out of my head",NA,"Cuando tengo un problema, no lo puedo sacar de mi cabeza"
PINTS,"When something upsets me, I think about it over and over","Cuando algo me molesta, pienso en ello una y otra vez","Cuando algo me molesta, lo pienso una y otra vez","Cuando algo me molesta, pienso en ello una y otra vez","When something bothers me, I think about it over and over again",NA,"Cuando algo me molesta, pienso en ello una y otra vez"
PINTS,I get stuck thinking about things,Me quedo atrapado pensando en cosas,N/A,Me quedo atrapado pensando en cosas,I get trapped thinking about things,NA,Me quedo atrapado pensando en cosas
PINTS,"When something difficult is coming up, I keep thinking about it all of the time","Cuando algo difícil está por venir, pienso en ello todo el tiempo",N/A,"Cuando algo difícil está por venir, pienso en ello todo el tiempo","When something difficult is coming, I think about it all the time",NA,"Cuando algo difícil está por venir, pienso en ello todo el tiempo"