variable,description,detail,allowedSuffix,valueType,allowedValues,valueInfo,naValueType,activeStatus,replacement,provenance
initstatea_sleep,Hours of sleep last night,How many hours of sleep did you get last night? (type in numerical answer),s1_r1_e1,Integer,"[0,24]",hours,NA,1,NA,direct-redcap
initstatea_caff,Amount of caffeine consumed today,"Compared to how much caffeine you typically consume up until this point in the day, how much caffeine have you had today?",s1_r1_e1,Integer,"0, 1, 2, 3, 4, 5, 6, 7, 8, 9, 10","0, No caffeine | 1,  | 2,  | 3,  | 4,  | 5, A typical amount | 6,  | 7,  | 8,  | 9,  | 10, An excessive amount",NA,1,NA,direct-redcap
initstatea_sick,General feeling of wellness,How sick or unwell do you feel right now?,s1_r1_e1,Integer,"0, 1, 2, 3, 4, 5, 6, 7, 8, 9, 10","0, Not sick/unwell at all | 1,  | 2,  | 3,  | 4,  | 5, Somewhat sick/unwell | 6,  | 7,  | 8,  | 9,  | 10, Very sick/unwell",NA,1,NA,direct-redcap
initstatea_hungry,Current level of hunger,How hungry are you right now?,s1_r1_e1,Integer,"0, 1, 2, 3, 4, 5, 6, 7, 8, 9, 10","0, Not hungry at all | 1,  | 2,  | 3,  | 4,  | 5, Somewhat hungry | 6,  | 7,  | 8,  | 9,  | 10, Extremely hungry",NA,1,NA,direct-redcap
initstatea_tired,Current level of tiredness,How tired do you feel right now?,s1_r1_e1,Integer,"0, 1, 2, 3, 4, 5, 6, 7, 8, 9, 10","0, Not tired at all | 1,  | 2,  | 3,  | 4,  | 5, Somewhat tired | 6,  | 7,  | 8,  | 9,  | 10, Extremely tired",NA,1,NA,direct-redcap